{
  "schema_version": 1,
  "command": "verify",
  "state": "blocked",
  "reason": "timed_out",
  "repository": {
    "root": "/repo",
    "branch": "main",
    "head": "0123456789abcdef0123456789abcdef01234567",
    "dirty": false,
    "fingerprint": "sha256:aaaaaaaaaaaaaaaaaaaaaaaaaaaaaaaaaaaaaaaaaaaaaaaaaaaaaaaaaaaaaaaa"
  },
  "run": {
    "id": "2026-10-09T12-00-00.000000000Z-a1b2c3d4",
    "evidence_path": ".lf/runs/2026-10-09T12-00-00.000000000Z-a1b2c3d4/evidence.json",
    "started_at": "2026-10-09T12:00:00Z",
    "finished_at": "2026-10-09T12:00:01Z",
    "state": "blocked",
    "reason": "timed_out",
    "branch": "main",
    "head": "0123456789abcdef0123456789abcdef01234567",
    "dirty": false,
    "fingerprint": "sha256:aaaaaaaaaaaaaaaaaaaaaaaaaaaaaaaaaaaaaaaaaaaaaaaaaaaaaaaaaaaaaaaa",
    "final_fingerprint": "sha256:aaaaaaaaaaaaaaaaaaaaaaaaaaaaaaaaaaaaaaaaaaaaaaaaaaaaaaaaaaaaaaaa"
  },
  "checks": [
    {
      "id": "test",
      "run": "go test ./...",
      "state": "blocked",
      "reason": "timed_out",
      "exit_code": -1,
      "duration_ms": 1800000,
      "timeout_ms": 1800000,
      "stdout_path": ".lf/runs/2026-10-09T12-00-00.000000000Z-a1b2c3d4/checks/test.stdout.txt",
      "stderr_path": ".lf/runs/2026-10-09T12-00-00.000000000Z-a1b2c3d4/checks/test.stderr.txt",
      "error": "check exceeded 30m0s timeout"
    }
  ]
}
